[
  {
    "assurance_class": "provisional_derived_proxy",
    "derivation_evidence_hash": "sha256:500b290e0e13e80c02f1072f33f879ab79f9cfa81a749295634e763dda75b6f2",
    "derivation_spec_hash": "sha256:b256595a8aed8861a196eb7335efbc72e3ed70bac462d8021abe47efde3597fe",
    "derivation_spec_id": "master_damodaran.implied_equity_risk_premium.prototype_v1.derived_proxy_v1",
    "dsl_version": "1.1",
    "id": "master_damodaran.implied_equity_risk_premium",
    "input_contracts": [
      {
        "on_missing": "fail",
        "period": {
          "alignment": "as_of",
          "basis": "instant",
          "window": null
        },
        "unit": "decimal",
        "value_kind": "ratio"
      },
      {
        "on_missing": "fail",
        "period": {
          "alignment": "as_of",
          "basis": "instant",
          "window": null
        },
        "unit": "decimal",
        "value_kind": "ratio"
      }
    ],
    "input_schema_hash": "sha256:2ed1240f33f9ed42d241ff758e8d43c9ee68fed7edcaacede625db0c08ef5ba4",
    "inputs": [
      {
        "fact_id": "index.aggregate_earnings_yield"
      },
      {
        "fact_id": "macro.long_bond_yield"
      }
    ],
    "intended_use": "local_test_only",
    "kind": "recomputation",
    "on_missing": "fail",
    "operation": "subtract",
    "output_id": "index.implied_equity_risk_premium.master_damodaran",
    "output_period": {
      "alignment": "as_of",
      "basis": "instant",
      "window": null
    },
    "output_schema_hash": "sha256:c2fcd47a4aa4014f89d12390ec92f592067ef12d2f18982fcf201f4c8d713d4e",
    "production_eligible": false,
    "review_status": "not_human_reviewed",
    "schema_version": 1,
    "source_ids": [
      "proxy:bcabfc2d756d028b0"
    ],
    "unit": "decimal",
    "value_kind": "ratio",
    "version": "0.2.0"
  },
  {
    "assurance_class": "provisional_derived_proxy",
    "derivation_evidence_hash": "sha256:5b557801dbdfeb202198eca16cfd22eaa009252ca9a39c3357e5000a1efabb90",
    "derivation_spec_hash": "sha256:3743c713e5c27017406e6d6bc79ed177415f868a7abd3a00093f308f0e79f744",
    "derivation_spec_id": "master_damodaran.premium_versus_long_run_average.prototype_v1.derived_proxy_v1",
    "dsl_version": "1.1",
    "id": "master_damodaran.premium_versus_long_run_average",
    "input_contracts": [
      {
        "on_missing": "fail",
        "period": {
          "alignment": "as_of",
          "basis": "instant",
          "window": null
        },
        "unit": "decimal",
        "value_kind": "ratio"
      },
      {
        "on_missing": "fail",
        "period": {
          "alignment": "as_of",
          "basis": "instant",
          "window": null
        },
        "unit": "derived_proxy_scalar",
        "value_kind": "scalar"
      }
    ],
    "input_schema_hash": "sha256:5f30cc56513316e32142651b812911eef0fcbce86aea6a5c7f3cc005d507e012",
    "inputs": [
      {
        "output_id": "index.implied_equity_risk_premium.master_damodaran"
      },
      {
        "literal": 0.042
      }
    ],
    "intended_use": "local_test_only",
    "kind": "recomputation",
    "on_missing": "fail",
    "operation": "subtract",
    "output_id": "index.implied_premium_gap.master_damodaran",
    "output_period": {
      "alignment": "as_of",
      "basis": "instant",
      "window": null
    },
    "output_schema_hash": "sha256:4b68698678a20f720d47bf9b66c5bb1e4839e72cd55fb4d8f978f7e4f82f418f",
    "production_eligible": false,
    "review_status": "not_human_reviewed",
    "schema_version": 1,
    "source_ids": [
      "proxy:bcabfc2d756d028b0"
    ],
    "unit": "decimal",
    "value_kind": "ratio",
    "version": "0.2.0"
  }
]
