[
  {
    "assurance_class": "provisional_derived_proxy",
    "derivation_evidence_hash": "sha256:98e274dd74d5d074be39602d3263ebcc8da02b25e13b8ec4feca3dc207383a03",
    "derivation_spec_hash": "sha256:319e46ff64092fb9577cba1ea97fc65ac74fb7021373aba0c7ec4111945f3712",
    "derivation_spec_id": "master_asness.factor_decomposer.prototype_v1.derived_proxy_v1",
    "dsl_version": "1.1",
    "id": "master_asness.factor_decomposer",
    "input_contracts": [
      {
        "on_missing": "fail",
        "period": {
          "alignment": "as_of",
          "basis": "instant",
          "window": null
        },
        "unit": "derived_proxy_scalar",
        "value_kind": "scalar"
      }
    ],
    "input_schema_hash": "sha256:23708482dd01e5b24a5bc4ca8ed22d9a6d360f35eb1132468607ffcac7dcdf39",
    "inputs": [
      {
        "fact_id": "factor.value_exposure"
      }
    ],
    "intended_use": "local_test_only",
    "kind": "transform",
    "on_missing": "fail",
    "operation": "identity",
    "output_id": "factor.value_exposure",
    "output_period": {
      "alignment": "as_of",
      "basis": "instant",
      "window": null
    },
    "output_schema_hash": "sha256:96545e2fbcc1831d18ada36155c50d55fa95c2803bf94187d562fa3bacf69f68",
    "production_eligible": false,
    "review_status": "not_human_reviewed",
    "schema_version": 1,
    "source_ids": [
      "proxy:b5b13eff4215f804d"
    ],
    "unit": "derived_proxy_scalar",
    "value_kind": "scalar",
    "version": "0.1.0"
  },
  {
    "assurance_class": "provisional_derived_proxy",
    "derivation_evidence_hash": "sha256:a5b1fe7376f9e07ba6c320d915420933c5b0e92c3732380d5690ad7b6825d30a",
    "derivation_spec_hash": "sha256:d9453ef6c6b917dca3aa0208f13087cf6f4607951985bfd495b5ce00d85beee1",
    "derivation_spec_id": "master_asness.crowding_cost_stress.prototype_v1.derived_proxy_v1",
    "dsl_version": "1.1",
    "id": "master_asness.crowding_cost_stress",
    "input_contracts": [
      {
        "on_missing": "fail",
        "period": {
          "alignment": "as_of",
          "basis": "instant",
          "window": null
        },
        "unit": "derived_proxy_scalar",
        "value_kind": "scalar"
      }
    ],
    "input_schema_hash": "sha256:dd5a7f94184e9ace1c84b7f68d783826e7a4aed2eb31c01d15024be93eb62104",
    "inputs": [
      {
        "fact_id": "factor.value_exposure"
      }
    ],
    "intended_use": "local_test_only",
    "kind": "transform",
    "on_missing": "fail",
    "operation": "identity",
    "output_id": "factor.crowding",
    "output_period": {
      "alignment": "as_of",
      "basis": "instant",
      "window": null
    },
    "output_schema_hash": "sha256:79b74a9de554814a9e993c479a1fbc11c13ea02198c202bf86559395dbfa4374",
    "production_eligible": false,
    "review_status": "not_human_reviewed",
    "schema_version": 1,
    "source_ids": [
      "proxy:b5b13eff4215f804d"
    ],
    "unit": "derived_proxy_scalar",
    "value_kind": "scalar",
    "version": "0.1.0"
  }
]
