[
  {
    "assurance_class": "provisional_derived_proxy",
    "derivation_evidence_hash": "sha256:95b1dbfb38191116b70157c669b21a3c3ea4224606c37b00fde20caa9ed39201",
    "derivation_spec_hash": "sha256:abce875912f1a767df44ba266165123b6be6b610553d2216104edc1c83d36993",
    "derivation_spec_id": "master_pabrai.downside_floor.prototype_v1.derived_proxy_v1",
    "dsl_version": "1.1",
    "id": "master_pabrai.downside_floor",
    "input_contracts": [
      {
        "on_missing": "fail",
        "period": {
          "alignment": "as_of",
          "basis": "instant",
          "window": null
        },
        "unit": "derived_proxy_scalar",
        "value_kind": "scalar"
      }
    ],
    "input_schema_hash": "sha256:b7e06487c36dd9e1442c793526cf8689e5afcca6e1dadf1b87f9017c996d5285",
    "inputs": [
      {
        "fact_id": "valuation.downside_floor"
      }
    ],
    "intended_use": "local_test_only",
    "kind": "transform",
    "on_missing": "fail",
    "operation": "identity",
    "output_id": "valuation.downside_floor",
    "output_period": {
      "alignment": "as_of",
      "basis": "instant",
      "window": null
    },
    "output_schema_hash": "sha256:f0a6178d5033c230d1f1ad1252ed1f27df8675c401beb010ac11a2684aba5df1",
    "production_eligible": false,
    "review_status": "not_human_reviewed",
    "schema_version": 1,
    "source_ids": [
      "derived_proxy:master_pabrai.downside_floor.prototype_v1"
    ],
    "unit": "derived_proxy_scalar",
    "value_kind": "scalar",
    "version": "0.1.0"
  },
  {
    "assurance_class": "provisional_derived_proxy",
    "derivation_evidence_hash": "sha256:20de6de0ec49831ff6dba8c759553ad9fab60baad3bc2e60c6fbfd14e3643e95",
    "derivation_spec_hash": "sha256:81d0fc120e8e215e78a220c9a84de36f6bcb29d22dec575503d59bddd9207172",
    "derivation_spec_id": "master_pabrai.discrete_payoff.prototype_v1.derived_proxy_v1",
    "dsl_version": "1.1",
    "id": "master_pabrai.discrete_payoff",
    "input_contracts": [
      {
        "on_missing": "fail",
        "period": {
          "alignment": "as_of",
          "basis": "instant",
          "window": null
        },
        "unit": "derived_proxy_scalar",
        "value_kind": "scalar"
      }
    ],
    "input_schema_hash": "sha256:bf0ffba61faa186fca759e978078d3e326c50004c6534943aa32c43279275bba",
    "inputs": [
      {
        "fact_id": "valuation.downside_floor"
      }
    ],
    "intended_use": "local_test_only",
    "kind": "transform",
    "on_missing": "fail",
    "operation": "identity",
    "output_id": "scenario.outcome_tree",
    "output_period": {
      "alignment": "as_of",
      "basis": "instant",
      "window": null
    },
    "output_schema_hash": "sha256:c9e1d4e9cbe21e75c5a42973c2fba83a39d30673cc89bcaa5880c3159386540e",
    "production_eligible": false,
    "review_status": "not_human_reviewed",
    "schema_version": 1,
    "source_ids": [
      "derived_proxy:master_pabrai.discrete_payoff.prototype_v1"
    ],
    "unit": "derived_proxy_scalar",
    "value_kind": "scalar",
    "version": "0.1.0"
  }
]
