[
  {
    "assurance_class": "provisional_derived_proxy",
    "derivation_evidence_hash": "sha256:2d201abdb47012d24388a65f9c58601d2910df10f22b91e60491e1c13b88ffe2",
    "derivation_spec_hash": "sha256:ff6b81460c97e1e04f0c765d6018c6e4ad3239c764604a25ec932a6724a81035",
    "derivation_spec_id": "master_simons.absolute_session_move.prototype_v1.derived_proxy_v1",
    "dsl_version": "1.1",
    "id": "master_simons.absolute_session_move",
    "input_contracts": [
      {
        "on_missing": "fail",
        "period": {
          "alignment": "as_of",
          "basis": "instant",
          "window": null
        },
        "unit": "decimal",
        "value_kind": "ratio"
      }
    ],
    "input_schema_hash": "sha256:66da9197ca6039973143eabfd429f44f765fbf3edc584fbc44fcdc2c1e3c5a38",
    "inputs": [
      {
        "fact_id": "market.change_pct"
      }
    ],
    "intended_use": "local_test_only",
    "kind": "recomputation",
    "on_missing": "fail",
    "operation": "abs",
    "output_id": "market.absolute_session_move.master_simons",
    "output_period": {
      "alignment": "as_of",
      "basis": "instant",
      "window": null
    },
    "output_schema_hash": "sha256:d27c5e9e327f0044e77671224912999b9dd405609e0a666272648dffc13fc850",
    "production_eligible": false,
    "review_status": "not_human_reviewed",
    "schema_version": 1,
    "source_ids": [
      "derived_proxy:master_simons.absolute_session_move.prototype_v1"
    ],
    "unit": "decimal",
    "value_kind": "ratio",
    "version": "0.2.0"
  },
  {
    "assurance_class": "provisional_derived_proxy",
    "derivation_evidence_hash": "sha256:84fad3eb5760b2c9d658505d852e674f61ee725cdb0a66a6b7f25913608b0758",
    "derivation_spec_hash": "sha256:e361609896735f3499bce98748b9d23217791003e4e47da707cc07e23f9acc94",
    "derivation_spec_id": "master_simons.session_move_over_implied.prototype_v1.derived_proxy_v1",
    "dsl_version": "1.1",
    "id": "master_simons.session_move_over_implied",
    "input_contracts": [
      {
        "on_missing": "fail",
        "period": {
          "alignment": "as_of",
          "basis": "instant",
          "window": null
        },
        "unit": "decimal",
        "value_kind": "ratio"
      },
      {
        "on_missing": "fail",
        "period": {
          "alignment": "as_of",
          "basis": "instant",
          "window": null
        },
        "unit": "decimal_annualized_volatility",
        "value_kind": "ratio"
      }
    ],
    "input_schema_hash": "sha256:9e496636aa58de5a954656bb4102bc4cb1dce7b921109b1775c05a8529a3e18d",
    "inputs": [
      {
        "output_id": "market.absolute_session_move.master_simons"
      },
      {
        "fact_id": "options.implied_volatility"
      }
    ],
    "intended_use": "local_test_only",
    "kind": "recomputation",
    "on_missing": "fail",
    "operation": "divide",
    "output_id": "market.session_move_over_implied.master_simons",
    "output_period": {
      "alignment": "as_of",
      "basis": "instant",
      "window": null
    },
    "output_schema_hash": "sha256:1b8a694c61762d2d695883bca43ccd229d8a844726cadd44bff09780b26f0cc6",
    "production_eligible": false,
    "review_status": "not_human_reviewed",
    "schema_version": 1,
    "source_ids": [
      "derived_proxy:master_simons.session_move_over_implied.prototype_v1"
    ],
    "unit": "decimal",
    "value_kind": "ratio",
    "version": "0.2.0"
  }
]
