[
  {
    "assurance_class": "provisional_derived_proxy",
    "derivation_evidence_hash": "sha256:5e7da98995b96ac2927b34d67ff3a62fc34f3885280711456321a690f7a45961",
    "derivation_spec_hash": "sha256:6c2a0161361b3ad536f3c77f9eacc8180864c6f27a53cb1bdc186a4a640a5bc6",
    "derivation_spec_id": "master_natenberg.surface_builder.prototype_v1.derived_proxy_v1",
    "dsl_version": "1.1",
    "id": "master_natenberg.surface_builder",
    "input_contracts": [
      {
        "on_missing": "fail",
        "period": {
          "alignment": "as_of",
          "basis": "instant",
          "window": null
        },
        "unit": "decimal_annualized_volatility",
        "value_kind": "ratio"
      }
    ],
    "input_schema_hash": "sha256:d2b44c26284465b216dd41348b1e659e6bc06bb75f8753d8420e8dde6b68dd09",
    "inputs": [
      {
        "fact_id": "options.implied_volatility"
      }
    ],
    "intended_use": "local_test_only",
    "kind": "transform",
    "on_missing": "fail",
    "operation": "identity",
    "output_id": "options.implied_volatility",
    "output_period": {
      "alignment": "as_of",
      "basis": "instant",
      "window": null
    },
    "output_schema_hash": "sha256:74437233e221a6bb8859595fdb733cebbefc7e5fd932c297b0af2f288c709a1f",
    "production_eligible": false,
    "review_status": "not_human_reviewed",
    "schema_version": 1,
    "source_ids": [
      "proxy:d71f61ac7584ae3fa"
    ],
    "unit": "decimal_annualized_volatility",
    "value_kind": "ratio",
    "version": "0.1.0"
  },
  {
    "assurance_class": "provisional_derived_proxy",
    "derivation_evidence_hash": "sha256:78bf6fc80b4b5101602a6b469998c74bfd1d90b5f1270300d1ead63c05ff0aa0",
    "derivation_spec_hash": "sha256:cd98be18eba8b61cdc2e57514a1d260facb2ea7c9e0846f31d581a7e3f396a5a",
    "derivation_spec_id": "master_natenberg.greeks_payoff.prototype_v1.derived_proxy_v1",
    "dsl_version": "1.1",
    "id": "master_natenberg.greeks_payoff",
    "input_contracts": [
      {
        "on_missing": "fail",
        "period": {
          "alignment": "as_of",
          "basis": "instant",
          "window": null
        },
        "unit": "decimal_annualized_volatility",
        "value_kind": "ratio"
      }
    ],
    "input_schema_hash": "sha256:b2e6f3fc599a417cc4459d185df3b962d14f9b8fc72b5b8182881e8efcfc9862",
    "inputs": [
      {
        "fact_id": "options.implied_volatility"
      }
    ],
    "intended_use": "local_test_only",
    "kind": "transform",
    "on_missing": "fail",
    "operation": "identity",
    "output_id": "options.greeks",
    "output_period": {
      "alignment": "as_of",
      "basis": "instant",
      "window": null
    },
    "output_schema_hash": "sha256:773f440b7fbd1d820afb37becdb69338bc65cb83da6070ac5da8646417e3ab11",
    "production_eligible": false,
    "review_status": "not_human_reviewed",
    "schema_version": 1,
    "source_ids": [
      "proxy:d71f61ac7584ae3fa"
    ],
    "unit": "decimal_annualized_volatility",
    "value_kind": "ratio",
    "version": "0.1.0"
  }
]
