[
  {
    "assurance_class": "provisional_derived_proxy",
    "derivation_evidence_hash": "sha256:3b2c6dbcfcb75c87e519f33572f7c654bade9dcdfa9b9e04cfbf2e30f08c3db0",
    "derivation_spec_hash": "sha256:fe6dcf021e691a1ff6633b8d6efb0db492209bd979d02a152975a26b6e377be4",
    "derivation_spec_id": "master_fisher.margin_retention.prototype_v1.derived_proxy_v1",
    "dsl_version": "1.1",
    "id": "master_fisher.margin_retention",
    "input_contracts": [
      {
        "on_missing": "fail",
        "period": {
          "alignment": "as_of",
          "basis": "instant",
          "window": null
        },
        "unit": "decimal",
        "value_kind": "ratio"
      },
      {
        "on_missing": "fail",
        "period": {
          "alignment": "as_of",
          "basis": "instant",
          "window": null
        },
        "unit": "decimal",
        "value_kind": "ratio"
      }
    ],
    "input_schema_hash": "sha256:fe049ed212e2a2a1fb25934100ed12a772ffe6c7f9eb9d5193db73ca0792600a",
    "inputs": [
      {
        "fact_id": "financial.net_margin_5y"
      },
      {
        "fact_id": "financial.gross_margin_5y"
      }
    ],
    "intended_use": "local_test_only",
    "kind": "recomputation",
    "on_missing": "fail",
    "operation": "divide",
    "output_id": "financial.margin_retention.master_fisher",
    "output_period": {
      "alignment": "as_of",
      "basis": "instant",
      "window": null
    },
    "output_schema_hash": "sha256:0ac030da1fcaac3f6ba0068259dc0e8e8eb7c26e143ca12762e7d674dfd6b523",
    "production_eligible": false,
    "review_status": "not_human_reviewed",
    "schema_version": 1,
    "source_ids": [
      "proxy:4749a48ca36b9289e"
    ],
    "unit": "decimal",
    "value_kind": "ratio",
    "version": "0.2.0"
  },
  {
    "assurance_class": "provisional_derived_proxy",
    "derivation_evidence_hash": "sha256:e57cec82efe8f7ce9ec989ab1c0246ae04e3746e160274b319a78d09a7de83bb",
    "derivation_spec_hash": "sha256:ad379ba38af7dd52b4e3ff1ad4a55f2ff6849594de3d5521aa1d94a3a22a46ee",
    "derivation_spec_id": "master_fisher.reinvestment_spread.prototype_v1.derived_proxy_v1",
    "dsl_version": "1.1",
    "id": "master_fisher.reinvestment_spread",
    "input_contracts": [
      {
        "on_missing": "fail",
        "period": {
          "alignment": "as_of",
          "basis": "instant",
          "window": null
        },
        "unit": "decimal",
        "value_kind": "ratio"
      },
      {
        "on_missing": "fail",
        "period": {
          "alignment": "as_of",
          "basis": "instant",
          "window": null
        },
        "unit": "decimal",
        "value_kind": "ratio"
      }
    ],
    "input_schema_hash": "sha256:8711bb8218a9790a85bdad83435670c6856bdc97cec715ef6d3962c3c759ad7a",
    "inputs": [
      {
        "fact_id": "financial.incremental_return_on_capital"
      },
      {
        "fact_id": "macro.aaa_corporate_yield"
      }
    ],
    "intended_use": "local_test_only",
    "kind": "recomputation",
    "on_missing": "fail",
    "operation": "subtract",
    "output_id": "financial.reinvestment_spread.master_fisher",
    "output_period": {
      "alignment": "as_of",
      "basis": "instant",
      "window": null
    },
    "output_schema_hash": "sha256:fd24ebe09318cde11e91bdeebbd0922f4acec9dfe38931b903bf98f581be3051",
    "production_eligible": false,
    "review_status": "not_human_reviewed",
    "schema_version": 1,
    "source_ids": [
      "proxy:4749a48ca36b9289e"
    ],
    "unit": "decimal",
    "value_kind": "ratio",
    "version": "0.2.0"
  }
]
