[
  {
    "assurance_class": "provisional_derived_proxy",
    "derivation_evidence_hash": "sha256:07d7686bd7ccc3295f969f7cbe23027f66e2a002ecaae1bd84c0bdd42681dcd4",
    "derivation_spec_hash": "sha256:29fb1efb5c858358d7cc41f50682266168837488ef3d7bf62eb06f8afd1f2880",
    "derivation_spec_id": "master_klarman.market_capitalisation.prototype_v1.derived_proxy_v1",
    "dsl_version": "1.1",
    "id": "master_klarman.market_capitalisation",
    "input_contracts": [
      {
        "on_missing": "fail",
        "period": {
          "alignment": "as_of",
          "basis": "instant",
          "window": null
        },
        "unit": "currency_units",
        "value_kind": "monetary"
      },
      {
        "on_missing": "fail",
        "period": {
          "alignment": "as_of",
          "basis": "duration",
          "window": "P1Y"
        },
        "unit": "shares",
        "value_kind": "count"
      }
    ],
    "input_schema_hash": "sha256:5bc9c03d2d93f259ac269327b521c239dd5b3f1063a20ff2fb287dbbe3eba09b",
    "inputs": [
      {
        "fact_id": "market.price"
      },
      {
        "fact_id": "capital_allocation.share_count"
      }
    ],
    "intended_use": "local_test_only",
    "kind": "recomputation",
    "on_missing": "fail",
    "operation": "multiply",
    "output_id": "valuation.market_capitalisation.master_klarman",
    "output_period": {
      "alignment": "as_of",
      "basis": "instant",
      "window": null
    },
    "output_schema_hash": "sha256:b6719fd11a39cb58b47243d8badb5ba4688387beb045e626cedc13c0994cf92d",
    "production_eligible": false,
    "review_status": "not_human_reviewed",
    "schema_version": 1,
    "source_ids": [
      "proxy:da526f9405e598b38"
    ],
    "unit": "currency_units",
    "value_kind": "monetary",
    "version": "0.2.0"
  },
  {
    "assurance_class": "provisional_derived_proxy",
    "derivation_evidence_hash": "sha256:5ba94fac5800c2e7735529742e03972dca1a6a4aaf6f279e590f530d97458c0c",
    "derivation_spec_hash": "sha256:be95e7b8f6c303cbf080c3f153400efb2dab0da2dad742131843dff542f6e6a9",
    "derivation_spec_id": "master_klarman.downside_asset_coverage.prototype_v1.derived_proxy_v1",
    "dsl_version": "1.1",
    "id": "master_klarman.downside_asset_coverage",
    "input_contracts": [
      {
        "on_missing": "fail",
        "period": {
          "alignment": "as_of",
          "basis": "instant",
          "window": null
        },
        "unit": "currency_units",
        "value_kind": "monetary"
      },
      {
        "on_missing": "fail",
        "period": {
          "alignment": "as_of",
          "basis": "instant",
          "window": null
        },
        "unit": "currency_units",
        "value_kind": "monetary"
      }
    ],
    "input_schema_hash": "sha256:bd9993175d84c3b83682917399a24fcb7858ad6d2fe8f2daeb0512e99dcac354",
    "inputs": [
      {
        "fact_id": "valuation.downside_asset_value"
      },
      {
        "output_id": "valuation.market_capitalisation.master_klarman"
      }
    ],
    "intended_use": "local_test_only",
    "kind": "recomputation",
    "on_missing": "fail",
    "operation": "divide",
    "output_id": "valuation.downside_asset_coverage.master_klarman",
    "output_period": {
      "alignment": "as_of",
      "basis": "instant",
      "window": null
    },
    "output_schema_hash": "sha256:320e2813dd6868c9c597d4b8943a6188d5a233786098fdb3363b9284027314fe",
    "production_eligible": false,
    "review_status": "not_human_reviewed",
    "schema_version": 1,
    "source_ids": [
      "proxy:da526f9405e598b38"
    ],
    "unit": "decimal",
    "value_kind": "ratio",
    "version": "0.2.0"
  }
]
