[
  {
    "assurance_class": "provisional_derived_proxy",
    "derivation_evidence_hash": "sha256:be45ecbd2a78bce27dd2feb7400935bb3f47d03a0a154964719c56a85e4ec0e4",
    "derivation_spec_hash": "sha256:9298a31cf40d017dd49ee0e9c55ee7aef395a9503500c2e74952d2bc11e9ca7e",
    "derivation_spec_id": "master_ackman.market_capitalisation.prototype_v1.derived_proxy_v1",
    "dsl_version": "1.1",
    "id": "master_ackman.market_capitalisation",
    "input_contracts": [
      {
        "on_missing": "fail",
        "period": {
          "alignment": "as_of",
          "basis": "instant",
          "window": null
        },
        "unit": "currency_units",
        "value_kind": "monetary"
      },
      {
        "on_missing": "fail",
        "period": {
          "alignment": "as_of",
          "basis": "duration",
          "window": "P1Y"
        },
        "unit": "shares",
        "value_kind": "count"
      }
    ],
    "input_schema_hash": "sha256:e4054170fe73d3a7231d7c3d293b1aa684df40b082302cb33fefbe4229e48518",
    "inputs": [
      {
        "fact_id": "market.price"
      },
      {
        "fact_id": "capital_allocation.share_count"
      }
    ],
    "intended_use": "local_test_only",
    "kind": "recomputation",
    "on_missing": "fail",
    "operation": "multiply",
    "output_id": "valuation.market_capitalisation.master_ackman",
    "output_period": {
      "alignment": "as_of",
      "basis": "instant",
      "window": null
    },
    "output_schema_hash": "sha256:2ec0bc21cd87228008a531f80b33352f0c113350c1ea7977b6f207d9209dd9c5",
    "production_eligible": false,
    "review_status": "not_human_reviewed",
    "schema_version": 1,
    "source_ids": [
      "proxy:16fb57696593fc4dc"
    ],
    "unit": "currency_units",
    "value_kind": "monetary",
    "version": "0.2.0"
  },
  {
    "assurance_class": "provisional_derived_proxy",
    "derivation_evidence_hash": "sha256:80968abbbfa03af12f2711821160902e684df17d31aac8166fdf4b1c264cb6b9",
    "derivation_spec_hash": "sha256:233af4f87f220dd426da53b6946ff1b4470579d98fb2440289a8c42d7007277f",
    "derivation_spec_id": "master_ackman.owner_earnings_yield.prototype_v1.derived_proxy_v1",
    "dsl_version": "1.1",
    "id": "master_ackman.owner_earnings_yield",
    "input_contracts": [
      {
        "on_missing": "fail",
        "period": {
          "alignment": "as_of",
          "basis": "duration",
          "window": "P1Y"
        },
        "unit": "currency_units",
        "value_kind": "monetary"
      },
      {
        "on_missing": "fail",
        "period": {
          "alignment": "as_of",
          "basis": "instant",
          "window": null
        },
        "unit": "currency_units",
        "value_kind": "monetary"
      }
    ],
    "input_schema_hash": "sha256:9f99ae402409f36da36df30b911141dd23e5be38b2b8f76f3597d1a1e125e518",
    "inputs": [
      {
        "fact_id": "financial.owner_earnings"
      },
      {
        "output_id": "valuation.market_capitalisation.master_ackman"
      }
    ],
    "intended_use": "local_test_only",
    "kind": "recomputation",
    "on_missing": "fail",
    "operation": "divide",
    "output_id": "valuation.owner_earnings_yield.master_ackman",
    "output_period": {
      "alignment": "as_of",
      "basis": "instant",
      "window": null
    },
    "output_schema_hash": "sha256:20259b82092a96c0cdf3979904198a8a7bd9a147ccd83ea3df214d1ed6e40809",
    "production_eligible": false,
    "review_status": "not_human_reviewed",
    "schema_version": 1,
    "source_ids": [
      "proxy:16fb57696593fc4dc"
    ],
    "unit": "decimal",
    "value_kind": "ratio",
    "version": "0.2.0"
  }
]
