[
  {
    "assurance_class": "provisional_derived_proxy",
    "derivation_evidence_hash": "sha256:f8b6d943e2936b2b7c281c83098f72ced75d897425e0ea0f45aff1e2948c0140",
    "derivation_spec_hash": "sha256:8d76c65b8d0aee17eeaaa15d8ac53ccfd8ad8d079eeea237e3b8d23eedfd3d5e",
    "derivation_spec_id": "master_aschenbrenner.market_capitalisation.prototype_v1.derived_proxy_v1",
    "dsl_version": "1.1",
    "id": "master_aschenbrenner.market_capitalisation",
    "input_contracts": [
      {
        "on_missing": "fail",
        "period": {
          "alignment": "as_of",
          "basis": "instant",
          "window": null
        },
        "unit": "currency_units",
        "value_kind": "monetary"
      },
      {
        "on_missing": "fail",
        "period": {
          "alignment": "as_of",
          "basis": "instant",
          "window": null
        },
        "unit": "shares",
        "value_kind": "count"
      }
    ],
    "input_schema_hash": "sha256:841a04d5dcb54b3336ba8eee846fa64c99f4a7950fedb19693536dcd5f22865c",
    "inputs": [
      {
        "fact_id": "market.price"
      },
      {
        "fact_id": "capital_allocation.share_count"
      }
    ],
    "intended_use": "local_test_only",
    "kind": "recomputation",
    "on_missing": "fail",
    "operation": "multiply",
    "output_id": "valuation.market_capitalisation.master_aschenbrenner",
    "output_period": {
      "alignment": "as_of",
      "basis": "instant",
      "window": null
    },
    "output_schema_hash": "sha256:8917b50c04a72b77622eb20ca4e40a5ef38a7c0c12c41ec8044a6d488eaacf84",
    "production_eligible": false,
    "review_status": "not_human_reviewed",
    "schema_version": 1,
    "source_ids": [
      "derived_proxy:master_aschenbrenner.market_capitalisation.prototype_v1"
    ],
    "unit": "currency_units",
    "value_kind": "monetary",
    "version": "0.2.0"
  },
  {
    "assurance_class": "provisional_derived_proxy",
    "derivation_evidence_hash": "sha256:9126653980212d2bfd254deddecfe2eecf60ab23e422f68f05dc66f92f2e1a98",
    "derivation_spec_hash": "sha256:cf3d02f5e7ab3138f3d25c34fcf4a8253187de58264d2f240d5570697e589f96",
    "derivation_spec_id": "master_aschenbrenner.price_implied_cash_yield.prototype_v1.derived_proxy_v1",
    "dsl_version": "1.1",
    "id": "master_aschenbrenner.price_implied_cash_yield",
    "input_contracts": [
      {
        "on_missing": "fail",
        "period": {
          "alignment": "as_of",
          "basis": "duration",
          "window": "P5Y"
        },
        "unit": "currency_units",
        "value_kind": "monetary"
      },
      {
        "on_missing": "fail",
        "period": {
          "alignment": "as_of",
          "basis": "instant",
          "window": null
        },
        "unit": "currency_units",
        "value_kind": "monetary"
      }
    ],
    "input_schema_hash": "sha256:a2b88f5cbd6f0e81fc14e37225e528aa6a3222fc74b170179a08ca1e339ddf56",
    "inputs": [
      {
        "fact_id": "financial.free_cash_flow_5y"
      },
      {
        "output_id": "valuation.market_capitalisation.master_aschenbrenner"
      }
    ],
    "intended_use": "local_test_only",
    "kind": "recomputation",
    "on_missing": "fail",
    "operation": "divide",
    "output_id": "valuation.free_cash_flow_yield.master_aschenbrenner",
    "output_period": {
      "alignment": "as_of",
      "basis": "instant",
      "window": null
    },
    "output_schema_hash": "sha256:c7d4f06e787fe7a5c7de5eb5c87f344d6a7f31c80ea5f7a7256f541f7cbcc0a2",
    "production_eligible": false,
    "review_status": "not_human_reviewed",
    "schema_version": 1,
    "source_ids": [
      "derived_proxy:master_aschenbrenner.price_implied_cash_yield.prototype_v1"
    ],
    "unit": "decimal",
    "value_kind": "ratio",
    "version": "0.2.0"
  }
]
