[
  {
    "assurance_class": "provisional_derived_proxy",
    "derivation_evidence_hash": "sha256:be1a19b6df6e6cbdafe6d045da217fb654631c50955c33fe1b1e88578c2a0bc8",
    "derivation_spec_hash": "sha256:054b23001e5493aec8528aa278d1ae4733e6c1af10dc1e9b13d552fab37180c0",
    "derivation_spec_id": "master_graham.defensive_hurdle_base.prototype_v1.derived_proxy_v1",
    "dsl_version": "1.1",
    "id": "master_graham.defensive_hurdle_base",
    "input_contracts": [
      {
        "on_missing": "fail",
        "period": {
          "alignment": "as_of",
          "basis": "instant",
          "window": null
        },
        "unit": "currency_units",
        "value_kind": "monetary"
      },
      {
        "on_missing": "fail",
        "period": {
          "alignment": "as_of",
          "basis": "instant",
          "window": null
        },
        "unit": "shares",
        "value_kind": "count"
      },
      {
        "on_missing": "fail",
        "period": {
          "alignment": "as_of",
          "basis": "instant",
          "window": null
        },
        "unit": "derived_proxy_scalar",
        "value_kind": "scalar"
      }
    ],
    "input_schema_hash": "sha256:c146eabbb0c2670477a04eb4c97a8882db9ce3abe08ab1cb4d07b9916bfd6b29",
    "inputs": [
      {
        "fact_id": "market.price"
      },
      {
        "fact_id": "capital_allocation.share_count"
      },
      {
        "literal": 10
      }
    ],
    "intended_use": "local_test_only",
    "kind": "recomputation",
    "on_missing": "fail",
    "operation": "multiply",
    "output_id": "valuation.graham_hurdle_base.master_graham",
    "output_period": {
      "alignment": "as_of",
      "basis": "instant",
      "window": null
    },
    "output_schema_hash": "sha256:8ede68c7a598562a9b98ca185f230643c6b755dbb374a396ebe7cc76d4375bd5",
    "production_eligible": false,
    "review_status": "not_human_reviewed",
    "schema_version": 1,
    "source_ids": [
      "proxy:efc142652d20dd68c"
    ],
    "unit": "currency_units",
    "value_kind": "monetary",
    "version": "0.2.0"
  },
  {
    "assurance_class": "provisional_derived_proxy",
    "derivation_evidence_hash": "sha256:c4aa7aeedf15dd3bfd673e08c165abeff468ee6bbf9f87859997238ad5d89cc2",
    "derivation_spec_hash": "sha256:3a6bfd410cabf900182c9371d308eb071bc1e42688bcb0a9f541e881c95c2ded",
    "derivation_spec_id": "master_graham.half_normalised_earnings_yield.prototype_v1.derived_proxy_v1",
    "dsl_version": "1.1",
    "id": "master_graham.half_normalised_earnings_yield",
    "input_contracts": [
      {
        "on_missing": "fail",
        "period": {
          "alignment": "as_of",
          "basis": "duration",
          "window": "P5Y"
        },
        "unit": "currency_units",
        "value_kind": "monetary"
      },
      {
        "on_missing": "fail",
        "period": {
          "alignment": "as_of",
          "basis": "instant",
          "window": null
        },
        "unit": "currency_units",
        "value_kind": "monetary"
      }
    ],
    "input_schema_hash": "sha256:b17a9b8f40bfa30cd19587afe13ae4666eb6120e9b6564b61f011723fa39d843",
    "inputs": [
      {
        "fact_id": "financial.free_cash_flow_5y"
      },
      {
        "output_id": "valuation.graham_hurdle_base.master_graham"
      }
    ],
    "intended_use": "local_test_only",
    "kind": "recomputation",
    "on_missing": "fail",
    "operation": "divide",
    "output_id": "valuation.graham_half_earnings_yield.master_graham",
    "output_period": {
      "alignment": "as_of",
      "basis": "instant",
      "window": null
    },
    "output_schema_hash": "sha256:490aa0af1468e2460fdabd32704272065ae782ad1ed41a4c7241d49e9f32528a",
    "production_eligible": false,
    "review_status": "not_human_reviewed",
    "schema_version": 1,
    "source_ids": [
      "proxy:efc142652d20dd68c"
    ],
    "unit": "decimal",
    "value_kind": "ratio",
    "version": "0.2.0"
  }
]
