[
  {
    "assurance_class": "provisional_derived_proxy",
    "derivation_evidence_hash": "sha256:b27bb7c7c3ffc9145a8ba0555c7017bb7be9076d7e623c12b23c1c46bb21a83e",
    "derivation_spec_hash": "sha256:a60f598d6c904dff435dd68ea3260c0c36223a40bfa224dae747a1bea627f6a3",
    "derivation_spec_id": "master_burry.net_current_asset_value_per_share.prototype_v1.derived_proxy_v1",
    "dsl_version": "1.1",
    "id": "master_burry.net_current_asset_value_per_share",
    "input_contracts": [
      {
        "on_missing": "fail",
        "period": {
          "alignment": "as_of",
          "basis": "instant",
          "window": null
        },
        "unit": "currency_units",
        "value_kind": "monetary"
      },
      {
        "on_missing": "fail",
        "period": {
          "alignment": "as_of",
          "basis": "instant",
          "window": null
        },
        "unit": "shares",
        "value_kind": "count"
      }
    ],
    "input_schema_hash": "sha256:89c2c47f2d7ff5349582e192b0646c8aecd8c1b6434edcc2765f94fd03e7ecf2",
    "inputs": [
      {
        "fact_id": "financial.net_current_asset_value"
      },
      {
        "fact_id": "capital_allocation.share_count"
      }
    ],
    "intended_use": "local_test_only",
    "kind": "recomputation",
    "on_missing": "fail",
    "operation": "divide",
    "output_id": "valuation.net_current_asset_value_per_share.master_burry",
    "output_period": {
      "alignment": "as_of",
      "basis": "instant",
      "window": null
    },
    "output_schema_hash": "sha256:c10be94b0d9105271e43dab507fe7a82626f9f271e0ab3b385df1b91b0a469fb",
    "production_eligible": false,
    "review_status": "not_human_reviewed",
    "schema_version": 1,
    "source_ids": [
      "derived_proxy:master_burry.net_current_asset_value_per_share.prototype_v1"
    ],
    "unit": "currency_units",
    "value_kind": "monetary",
    "version": "0.2.0"
  },
  {
    "assurance_class": "provisional_derived_proxy",
    "derivation_evidence_hash": "sha256:42dbe723e4ddde94ff483a4ab412af0ffa2d3fadb0b0a35c64457ada37242757",
    "derivation_spec_hash": "sha256:c8832a0bc3de2baffb20e3014cd361eb5bfe5756320ba3c7e3ffc9b57e61df9d",
    "derivation_spec_id": "master_burry.net_current_asset_surplus_per_share.prototype_v1.derived_proxy_v1",
    "dsl_version": "1.1",
    "id": "master_burry.net_current_asset_surplus_per_share",
    "input_contracts": [
      {
        "on_missing": "fail",
        "period": {
          "alignment": "as_of",
          "basis": "instant",
          "window": null
        },
        "unit": "currency_units",
        "value_kind": "monetary"
      },
      {
        "on_missing": "fail",
        "period": {
          "alignment": "as_of",
          "basis": "instant",
          "window": null
        },
        "unit": "currency_units",
        "value_kind": "monetary"
      }
    ],
    "input_schema_hash": "sha256:0cd1a6e8e61d72cee1b2615e91a7687baaab36b390137a1012d90d83d6b937a4",
    "inputs": [
      {
        "output_id": "valuation.net_current_asset_value_per_share.master_burry"
      },
      {
        "fact_id": "market.price"
      }
    ],
    "intended_use": "local_test_only",
    "kind": "recomputation",
    "on_missing": "fail",
    "operation": "subtract",
    "output_id": "valuation.net_current_asset_surplus_per_share.master_burry",
    "output_period": {
      "alignment": "as_of",
      "basis": "instant",
      "window": null
    },
    "output_schema_hash": "sha256:b59371d44066cbced10265fe3c9e4f3254bb9cdb56502f3f77f80ba4e9040d63",
    "production_eligible": false,
    "review_status": "not_human_reviewed",
    "schema_version": 1,
    "source_ids": [
      "derived_proxy:master_burry.net_current_asset_surplus_per_share.prototype_v1"
    ],
    "unit": "currency_units",
    "value_kind": "monetary",
    "version": "0.2.0"
  }
]
