[
  {
    "assurance_class": "provisional_derived_proxy",
    "derivation_evidence_hash": "sha256:6a634a8c4e38f23d1dd09363011d3d37a7da86f5b27942cde4abcaa098a7e131",
    "derivation_spec_hash": "sha256:b0d6d7d43a67d421d8c5c3729388d75c02e852202c4ba1b36580737d6b8c27e4",
    "derivation_spec_id": "master_druckenmiller.liquidity_curve_impulse.prototype_v1.derived_proxy_v1",
    "dsl_version": "1.1",
    "id": "master_druckenmiller.liquidity_curve_impulse",
    "input_contracts": [
      {
        "on_missing": "fail",
        "period": {
          "alignment": "as_of",
          "basis": "duration",
          "window": "P3M"
        },
        "unit": "decimal",
        "value_kind": "ratio"
      },
      {
        "on_missing": "fail",
        "period": {
          "alignment": "as_of",
          "basis": "instant",
          "window": null
        },
        "unit": "decimal",
        "value_kind": "ratio"
      }
    ],
    "input_schema_hash": "sha256:80b1060ab65bd3e9744b0a299c365d1c99964fa0f4c12407bb6e99add899f966",
    "inputs": [
      {
        "fact_id": "macro.liquidity_impulse"
      },
      {
        "fact_id": "macro.term_structure_slope"
      }
    ],
    "intended_use": "local_test_only",
    "kind": "recomputation",
    "on_missing": "fail",
    "operation": "mean",
    "output_id": "macro.liquidity_curve_impulse.master_druckenmiller",
    "output_period": {
      "alignment": "as_of",
      "basis": "instant",
      "window": null
    },
    "output_schema_hash": "sha256:97b54b6b7deb6d24a5e8a8b51eb6977faa9271a5ebf2a105ba7e6cc2724282b6",
    "production_eligible": false,
    "review_status": "not_human_reviewed",
    "schema_version": 1,
    "source_ids": [
      "proxy:807c7db58258313d3"
    ],
    "unit": "decimal",
    "value_kind": "ratio",
    "version": "0.2.0"
  },
  {
    "assurance_class": "provisional_derived_proxy",
    "derivation_evidence_hash": "sha256:f8b940481d3fa00e03a6421d2799642ec64df5d2f772463a1bf35000bf46c0fa",
    "derivation_spec_hash": "sha256:751eba4c8384522c5bc7525ed89316c1d0dc3eb4c666dd14ecf82892d2d59675",
    "derivation_spec_id": "master_druckenmiller.policy_real_rate.prototype_v1.derived_proxy_v1",
    "dsl_version": "1.1",
    "id": "master_druckenmiller.policy_real_rate",
    "input_contracts": [
      {
        "on_missing": "fail",
        "period": {
          "alignment": "as_of",
          "basis": "instant",
          "window": null
        },
        "unit": "decimal",
        "value_kind": "ratio"
      },
      {
        "on_missing": "fail",
        "period": {
          "alignment": "as_of",
          "basis": "instant",
          "window": null
        },
        "unit": "decimal",
        "value_kind": "ratio"
      }
    ],
    "input_schema_hash": "sha256:669e5a4696218553ed1861556c82a87a1cf7cdcf3da8ec843847fa08e46333c0",
    "inputs": [
      {
        "fact_id": "macro.short_bond_yield"
      },
      {
        "fact_id": "macro.breakeven_inflation"
      }
    ],
    "intended_use": "local_test_only",
    "kind": "recomputation",
    "on_missing": "fail",
    "operation": "subtract",
    "output_id": "macro.policy_real_rate.master_druckenmiller",
    "output_period": {
      "alignment": "as_of",
      "basis": "instant",
      "window": null
    },
    "output_schema_hash": "sha256:ed57d8a389df796e06fea54648869a277582d5c91217d59b582b750e6b1d4133",
    "production_eligible": false,
    "review_status": "not_human_reviewed",
    "schema_version": 1,
    "source_ids": [
      "proxy:807c7db58258313d3"
    ],
    "unit": "decimal",
    "value_kind": "ratio",
    "version": "0.2.0"
  }
]
